<?xml version="1.0" encoding="UTF-8"?>
<?xml-stylesheet type="text/xsl" href="http://lsst-sal.tuc.noao.edu/schema/SALCommandSet.xsl"?>
<SALCommandSet xmlns:xsi="http://www.w3.org/2001/XMLSchema-instance" xsi:noNamespaceSchemaLocation="http://lsst-sal.tuc.noao.edu/schema/SALCommandSet.xsd">
  <SALCommand>
    <Subsystem>GenericCamera</Subsystem>
    <EFDB_Topic>GenericCamera_command_setROI</EFDB_Topic>
    <item>
      <EFDB_Name>topPixel</EFDB_Name>
      <Description>This is the regions top most pixel number (base 0).</Description>
      <IDL_Type>int</IDL_Type>
      <Units>pixel</Units>
      <Count>1</Count>
    </item>
    <item>
      <EFDB_Name>leftPixel</EFDB_Name>
      <Description>This is the regions left most pixel number (base 0).</Description>
      <IDL_Type>int</IDL_Type>
      <Units>pixel</Units>
      <Count>1</Count>
    </item>
    <item>
      <EFDB_Name>width</EFDB_Name>
      <Description>This is the regions width in pixels.</Description>
      <IDL_Type>int</IDL_Type>
      <Units>pixel</Units>
      <Count>1</Count>
    </item>
    <item>
      <EFDB_Name>height</EFDB_Name>
      <Description>This is the regions height in pixels.</Description>
      <IDL_Type>int</IDL_Type>
      <Units>pixel</Units>
      <Count>1</Count>
    </item>
  </SALCommand>
  <SALCommand>
    <Subsystem>GenericCamera</Subsystem>
    <EFDB_Topic>GenericCamera_command_setFullFrame</EFDB_Topic>
    <item>
      <EFDB_Name>ignored</EFDB_Name>
      <Description>This value is ignored.</Description>
      <IDL_Type>boolean</IDL_Type>
      <Units>unitless</Units>
      <Count>1</Count>
    </item>
  </SALCommand>
  <SALCommand>
    <Subsystem>GenericCamera</Subsystem>
    <EFDB_Topic>GenericCamera_command_startLiveView</EFDB_Topic>
    <item>
      <EFDB_Name>expTime</EFDB_Name>
      <Description>Exposure time.</Description>
      <IDL_Type>double</IDL_Type>
      <Units>second</Units>
      <Count>1</Count>
    </item>
  </SALCommand>
  <SALCommand>
    <Subsystem>GenericCamera</Subsystem>
    <EFDB_Topic>GenericCamera_command_stopLiveView</EFDB_Topic>
    <item>
      <EFDB_Name>ignored</EFDB_Name>
      <Description>This value is ignored.</Description>
      <IDL_Type>boolean</IDL_Type>
      <Units>unitless</Units>
      <Count>1</Count>
    </item>
  </SALCommand>
  <SALCommand>
    <Subsystem>GenericCamera</Subsystem>
    <EFDB_Topic>GenericCamera_command_takeImages</EFDB_Topic>
    <item>
      <EFDB_Name>numImages</EFDB_Name>
      <Description>Number of consecutive images to take</Description>
      <IDL_Type>long</IDL_Type>
      <Units>unitless</Units>
      <Count>1</Count>
    </item>
    <item>
      <EFDB_Name>expTime</EFDB_Name>
      <Description>Exposure time</Description>
      <IDL_Type>double</IDL_Type>
      <Units>second</Units>
      <Count>1</Count>
    </item>
    <item>
      <EFDB_Name>shutter</EFDB_Name>
      <Description>True if the shutter should be opened/closed</Description>
      <IDL_Type>boolean</IDL_Type>
      <Units>unitless</Units>
      <Count>1</Count>
    </item>
    <item>
      <EFDB_Name>sensors</EFDB_Name>
      <Description>Sensors to be read out, if blank all configured sensors will be read out</Description>
      <IDL_Type>string</IDL_Type>
      <IDL_Size>1</IDL_Size>
      <Units>unitless</Units>
      <Count>1</Count>
    </item>
    <item>
      <EFDB_Name>keyValueMap</EFDB_Name>
      <Description>Map of additional key value pairs to associate extra data with the image(s), e.g. imageType: XYZ, groupId: ABC</Description>
      <IDL_Type>string</IDL_Type>
      <IDL_Size>1</IDL_Size>
      <Units>unitless</Units>
      <Count>1</Count>
    </item>
    <item>
      <EFDB_Name>obsNote</EFDB_Name>
      <Description>An arbitrary operator provided string, useful for informally flagging images</Description>
      <IDL_Type>string</IDL_Type>
      <IDL_Size>1</IDL_Size>
      <Units>unitless</Units>
      <Count>1</Count>
    </item>
  </SALCommand>
</SALCommandSet>
