<?xml version="1.0" encoding="UTF-8"?>
<?xml-stylesheet type="text/xsl" href="http://lsst-sal.tuc.noao.edu/schema/SALCommandSet.xsl"?>
<SALCommandSet xmlns:xsi="http://www.w3.org/2001/XMLSchema-instance"
	xsi:noNamespaceSchemaLocation="http://lsst-sal.tuc.noao.edu/schema/SALCommandSet.xsd">

<SALCommand>
 <Subsystem>domeTHCS</Subsystem>
 <Version>1.0.0</Version>
 <Author>ebragante</Author>
 <EFDB_Topic>domeTHCS_command_Echo</EFDB_Topic>
 <Alias>Echo</Alias>
 <Device>adb</Device>
 <Property></Property>
 <Action></Action>
 <Value></Value>
 <Explanation></Explanation>
    <item>
      <EFDB_Name>status</EFDB_Name>
      <Description> </Description>
       <IDL_Type>int</IDL_Type>
      <Units> </Units>
      <Count>1</Count>
    </item>
</SALCommand>

</SALCommandSet>

