<?xml version="1.0" encoding="UTF-8"?>
<?xml-stylesheet type="text/xsl" href="http://lsst-sal.tuc.noao.edu/schema/SALCommandSet.xsl"?>
<SALCommandSet xmlns:xsi="http://www.w3.org/2001/XMLSchema-instance"
	xsi:noNamespaceSchemaLocation="http://lsst-sal.tuc.noao.edu/schema/SALCommandSet.xsd">

 <SALCommand>
  <Subsystem>Sequencer</Subsystem>
  <Version>3.8.0</Version>
  <Author>salgenerator</Author>
  <EFDB_Topic>Sequencer_command_sequence</EFDB_Topic>
  <Alias>sequence</Alias>
  <Device>sequence</Device>
  <Property></Property>
  <Action></Action>
  <Value></Value>
  <Explanation>http://sal.lsst.org/SAL/Commands/Sequencer_command_sequence.html</Explanation>
   <item>
    <EFDB_Name>command</EFDB_Name>
    <Description></Description>
    <IDL_Type>string</IDL_Type>
    <IDL_Size>256</IDL_Size>
    <Units></Units>
    <Count>1</Count>
   </item>
 </SALCommand>

 <SALCommand>
  <Subsystem>Sequencer</Subsystem>
  <Version>3.8.0</Version>
  <Author>salgenerator</Author>
  <EFDB_Topic>Sequencer_command_script</EFDB_Topic>
  <Alias>script</Alias>
  <Device>script</Device>
  <Property></Property>
  <Action></Action>
  <Value></Value>
  <Explanation>http://sal.lsst.org/SAL/Commands/Sequencer_command_script.html</Explanation>
   <item>
    <EFDB_Name>location</EFDB_Name>
    <Description></Description>
    <IDL_Type>string</IDL_Type>
    <IDL_Size>256</IDL_Size>
    <Units></Units>
    <Count>1</Count>
   </item>
 </SALCommand>
</SALCommandSet>
