<?xml version="1.0" encoding="UTF-8"?>
<?xml-stylesheet type="text/xsl" href="http://project.lsst.org/ts/sal_objects/schema/SALCommandSet.xsl"?>
<SALCommandSet xmlns:xsi="http://www.w3.org/2001/XMLSchema-instance"
	xsi:noNamespaceSchemaLocation="http://project.lsst.org/ts/sal_objects/schema/SALCommandSet.xsd">
<SALCommand>
    <Subsystem>atArchiver</Subsystem>
    <Version>3.7.1</Version>
    <Author>Htut Khine Win(hwin16@illinois.edu)</Author>
    <EFDB_Topic>atArchiver_command_abort</EFDB_Topic>
    <Alias>abort</Alias>
    <Device></Device>
    <Property></Property>
    <Action></Action>
    <Value></Value>
    <Explanation>http://project.lsst.org/ts/sal_objects/help</Explanation>
    <item>
        <EFDB_Name>state</EFDB_Name>
        <Description></Description>
        <IDL_Type>boolean</IDL_Type>
        <Units></Units>
        <Count>1</Count>
    </item>
</SALCommand>
<SALCommand>
    <Subsystem>atArchiver</Subsystem>
    <Version>3.7.1</Version>
    <Author></Author>
    <EFDB_Topic>atArchiver_command_enable</EFDB_Topic>
    <Alias>enable</Alias>
    <Device></Device>
    <Property></Property>
    <Action></Action>
    <Value></Value>
    <Explanation>http://project.lsst.org/ts/sal_objects/help</Explanation>
    <item>
        <EFDB_Name>state</EFDB_Name>
        <Description></Description>
        <IDL_Type>boolean</IDL_Type>
        <Units></Units>
        <Count>1</Count>
    </item>
</SALCommand>
<SALCommand>
    <Subsystem>atArchiver</Subsystem>
    <Version>3.7.1</Version>
    <Author></Author>
    <EFDB_Topic>atArchiver_command_disable</EFDB_Topic>
    <Alias>disable</Alias>
    <Device></Device>
    <Property></Property>
    <Action></Action>
    <Value></Value>
    <Explanation>http://project.lsst.org/ts/sal_objects/help</Explanation>
    <item>
        <EFDB_Name>state</EFDB_Name>
        <Description></Description>
        <IDL_Type>boolean</IDL_Type>
        <Units></Units>
        <Count>1</Count>
    </item>
</SALCommand>
<SALCommand>
    <Subsystem>atArchiver</Subsystem>
    <Version>3.7.1</Version>
    <Author></Author>
    <EFDB_Topic>atArchiver_command_standby</EFDB_Topic>
    <Alias>standby</Alias>
    <Device></Device>
    <Property></Property>
    <Action></Action>
    <Value></Value>
    <Explanation>http://project.lsst.org/ts/sal_objects/help</Explanation>
    <item>
        <EFDB_Name>state</EFDB_Name>
        <Description></Description>
        <IDL_Type>boolean</IDL_Type>
        <Units></Units>
        <Count>1</Count>
    </item>
</SALCommand>
<SALCommand>
    <Subsystem>atArchiver</Subsystem>
    <Version>3.7.1</Version>
    <Author></Author>
    <EFDB_Topic>atArchiver_command_exitControl</EFDB_Topic>
    <Alias>exitControl</Alias>
    <Device></Device>
    <Property></Property>
    <Action></Action>
    <Value></Value>
    <Explanation>http://project.lsst.org/ts/sal_objects/help</Explanation>
    <item>
        <EFDB_Name>state</EFDB_Name>
        <Description></Description>
        <IDL_Type>boolean</IDL_Type>
        <Units></Units>
        <Count>1</Count>
    </item>
</SALCommand>
<SALCommand>
    <Subsystem>atArchiver</Subsystem>
    <Version>3.7.1</Version>
    <Author></Author>
    <EFDB_Topic>atArchiver_command_start</EFDB_Topic>
    <Alias>start</Alias>
    <Device></Device>
    <Property></Property>
    <Action></Action>
    <Value></Value>
    <Explanation>http://project.lsst.org/ts/sal_objects/help</Explanation>
    <item>
        <EFDB_Name>configuration</EFDB_Name>
        <Description></Description>
        <IDL_Type>string</IDL_Type>
        <IDL_Size>256</IDL_Size>
        <Units></Units>
        <Count>1</Count>
    </item>
</SALCommand>
<SALCommand>
    <Subsystem>atArchiver</Subsystem>
    <Version>3.7.1</Version>
    <Author>Htut Khine Win(hwin16@illinois.edu)</Author>
    <EFDB_Topic>atArchiver_command_enterControl</EFDB_Topic>
    <Alias>enterControl</Alias>
    <Device></Device>
    <Property></Property>
    <Action></Action>
    <Value></Value>
    <Explanation>http://project.lsst.org/ts/sal_objects/help</Explanation>
    <item>
        <EFDB_Name>state</EFDB_Name>
        <Description></Description>
        <IDL_Type>boolean</IDL_Type>
        <Units></Units>
        <Count>1</Count>
    </item>
</SALCommand>
<SALCommand>
    <Subsystem>atArchiver</Subsystem>
    <Version>3.7.1</Version>
    <Author></Author>
    <EFDB_Topic>atArchiver_command_setValue</EFDB_Topic>
    <Alias>setValue</Alias>
    <Device></Device>
    <Property></Property>
    <Action></Action>
    <Value></Value>
    <Explanation>http://project.lsst.org/ts/sal_objects/help</Explanation>
    <item>
        <EFDB_Name>json_parameters</EFDB_Name>
        <Description></Description>
        <IDL_Type>string</IDL_Type>
        <IDL_Size>256</IDL_Size>
        <Units></Units>
        <Count>1</Count>
    </item>
</SALCommand>
<SALCommand>
    <Subsystem>atArchiver</Subsystem>
    <Version>3.7.1</Version>
    <Author></Author>
    <EFDB_Topic>atArchiver_command_resetFromFault</EFDB_Topic>
    <Alias>resetFromFault</Alias>
    <Device></Device>
    <Property></Property>
    <Action></Action>
    <Value></Value>
    <Explanation>http://project.lsst.org/ts/sal_objects/help</Explanation>
</SALCommand></SALCommandSet>
