<?xml version="1.0" encoding="UTF-8"?>
<?xml-stylesheet type="text/xsl" href="http://lsst-sal.tuc.noao.edu/schema/SALCommandSet.xsl"?>
<SALCommandSet xmlns:xsi="http://www.w3.org/2001/XMLSchema-instance" xsi:noNamespaceSchemaLocation="http://lsst-sal.tuc.noao.edu/schema/SALCommandSet.xsd">
  <SALCommand>
    <Subsystem>LinearStage</Subsystem>
    <Version>3.7.1</Version>
    <Author>ecoughlin</Author>
    <EFDB_Topic>LinearStage_command_moveRelative</EFDB_Topic>
    <Alias>moveRelative</Alias>
    <Device/>
    <Property/>
    <Action/>
    <Value/>
    <Explanation>http://sal.lsst.org</Explanation>
    <item>
      <EFDB_Name>distance</EFDB_Name>
      <Description>The amount of millimeters to move the stage.</Description>
      <IDL_Type>float</IDL_Type>
      <Units>millimeter</Units>
      <Count>1</Count>
    </item>
    <item>
      <EFDB_Name>timestamp</EFDB_Name>
      <Description>The timestamp for when the event occurred.</Description>
      <IDL_Type>double</IDL_Type>
      <Units>second</Units>
      <Count>1</Count>
    </item>
  </SALCommand>
  <SALCommand>
    <Subsystem>LinearStage</Subsystem>
    <Version>3.7.1</Version>
    <Author>ecoughlin</Author>
    <EFDB_Topic>LinearStage_command_moveAbsolute</EFDB_Topic>
    <Alias>moveAbsolute</Alias>
    <Device/>
    <Property/>
    <Action/>
    <Value/>
    <Explanation>http://sal.lsst.org</Explanation>
    <item>
      <EFDB_Name>distance</EFDB_Name>
      <Description>The amount to move the device</Description>
      <IDL_Type>float</IDL_Type>
      <Units>millimeter</Units>
      <Count>1</Count>
    </item>
    <item>
      <EFDB_Name>timestamp</EFDB_Name>
      <Description>The timestamp for when the event occurred.</Description>
      <IDL_Type>double</IDL_Type>
      <Units>second</Units>
      <Count>1</Count>
    </item>
  </SALCommand>
  <SALCommand>
    <Subsystem>LinearStage</Subsystem>
    <Version>3.7.1</Version>
    <Author>ecoughlin</Author>
    <EFDB_Topic>LinearStage_command_getHome</EFDB_Topic>
    <Alias>getHome</Alias>
    <Device/>
    <Property/>
    <Action/>
    <Value/>
    <Explanation>http://sal.lsst.org</Explanation>
    <item>
      <EFDB_Name>value</EFDB_Name>
      <Description>Attribute required by the SAL API, but is unused.</Description>
      <IDL_Type>boolean</IDL_Type>
      <Units>unitless</Units>
      <Count>1</Count>
    </item>
    <item>
      <EFDB_Name>timestamp</EFDB_Name>
      <Description>The timestamp for when the event occurred.</Description>
      <IDL_Type>double</IDL_Type>
      <Units>second</Units>
      <Count>1</Count>
    </item>
  </SALCommand>
  <SALCommand>
    <Subsystem>LinearStage</Subsystem>
    <Version>3.7.1</Version>
    <Author>ecoughlin</Author>
    <EFDB_Topic>LinearStage_command_stop</EFDB_Topic>
    <Alias>stop</Alias>
    <Device/>
    <Property/>
    <Action/>
    <Value/>
    <Explanation>http://sal.lsst.org</Explanation>
    <item>
      <EFDB_Name>value</EFDB_Name>
      <Description>Attribute required by SAL API, but is unused.</Description>
      <IDL_Type>boolean</IDL_Type>
      <Units>unitless</Units>
      <Count>1</Count>
    </item>
    <item>
      <EFDB_Name>timestamp</EFDB_Name>
      <Description>The timestamp for when the event occurred.</Description>
      <IDL_Type>double</IDL_Type>
      <Units>second</Units>
      <Count>1</Count>
    </item>
  </SALCommand>
</SALCommandSet>
