<?xml version="1.0" encoding="UTF-8"?>
<?xml-stylesheet type="text/xsl" href="http://project.lsst.org/ts/sal_objects/schema/SALCommandSet.xsl"?>
<SALCommandSet xmlns:xsi="http://www.w3.org/2001/XMLSchema-instance"
	xsi:noNamespaceSchemaLocation="http://project.lsst.org/ts/sal_objects/schema/SALCommandSet.xsd">
<SALCommand>
    <Subsystem>CCCamera</Subsystem>
    <Version>3.7.1</Version>
    <Author></Author>
    <EFDB_Topic>CCCamera_command_discardRows</EFDB_Topic>
    <Alias>discardRows</Alias>
    <Device></Device>
    <Property></Property>
    <Action></Action>
    <Value></Value>
    <Explanation>http://project.lsst.org/ts/sal_objects/help</Explanation>
    <item>
        <EFDB_Name>nRows</EFDB_Name>
        <Description>Number of rows to discard</Description>
        <IDL_Type>long</IDL_Type>
        <Units>unitless</Units>
        <Count>1</Count>
    </item>
</SALCommand>
<SALCommand>
    <Subsystem>CCCamera</Subsystem>
    <Version>3.7.1</Version>
    <Author></Author>
    <EFDB_Topic>CCCamera_command_startImage</EFDB_Topic>
    <Alias>startImage</Alias>
    <Device></Device>
    <Property></Property>
    <Action></Action>
    <Value></Value>
    <Explanation>http://project.lsst.org/ts/sal_objects/help</Explanation>
    <item>
        <EFDB_Name>shutter</EFDB_Name>
        <Description>True if the shutter should be opened/closed</Description>
        <IDL_Type>boolean</IDL_Type>
        <Units>unitless</Units>
        <Count>1</Count>
    </item>
    <item>
        <EFDB_Name>sensors</EFDB_Name>
        <Description>Sensors to be read out, if blank all configured sensors will be read out</Description>
        <IDL_Type>string</IDL_Type>
        <Units>unitless</Units>
        <Count>1</Count>
    </item>
    <item>
        <EFDB_Name>keyValueMap</EFDB_Name>
        <Description>Map of additional key value pairs, e.g. imageType: XYZ, groupId: ABC</Description>
        <IDL_Type>string</IDL_Type>
        <Units>unitless</Units>
        <Count>1</Count>
    </item>
    <item>
        <EFDB_Name>obsNote</EFDB_Name>
        <Description>An arbitrary operator provided string, useful for informally flagging images</Description>
        <IDL_Type>string</IDL_Type>
        <Units>unitless</Units>
        <Count>1</Count>
    </item>
    <item>
        <EFDB_Name>timeout</EFDB_Name>
        <Description>Timeout after which imaging will be abandoned if no endImage command received</Description>
        <IDL_Type>double</IDL_Type>
        <Units>second</Units>
        <Count>1</Count>
    </item>
</SALCommand>
<SALCommand>
    <Subsystem>CCCamera</Subsystem>
    <Version>3.7.1</Version>
    <Author></Author>
    <EFDB_Topic>CCCamera_command_disableCalibration</EFDB_Topic>
    <Alias>disableCalibration</Alias>
    <Device></Device>
    <Property></Property>
    <Action></Action>
    <Value></Value>
    <Explanation>http://project.lsst.org/ts/sal_objects/help</Explanation>
    <item>
        <EFDB_Name>value</EFDB_Name>
        <Description>Attribute required by the API, but is unused.</Description>
        <IDL_Type>boolean</IDL_Type>
        <Units>unitless</Units>
        <Count>1</Count>
    </item>
</SALCommand>
<SALCommand>
    <Subsystem>CCCamera</Subsystem>
    <Version>3.7.1</Version>
    <Author></Author>
    <EFDB_Topic>CCCamera_command_initGuiders</EFDB_Topic>
    <Alias>initGuiders</Alias>
    <Device></Device>
    <Property></Property>
    <Action></Action>
    <Value></Value>
    <Explanation>http://project.lsst.org/ts/sal_objects/help</Explanation>
    <item>
        <EFDB_Name>roiSpec</EFDB_Name>
        <Description>TBD specification for region of interest</Description>
        <IDL_Type>string</IDL_Type>
        <IDL_Size>256</IDL_Size>
        <Units>unitless</Units>
        <Count>1</Count>
    </item>
</SALCommand>
<SALCommand>
    <Subsystem>CCCamera</Subsystem>
    <Version>3.7.1</Version>
    <Author></Author>
    <EFDB_Topic>CCCamera_command_enableCalibration</EFDB_Topic>
    <Alias>enableCalibration</Alias>
    <Device></Device>
    <Property></Property>
    <Action></Action>
    <Value></Value>
    <Explanation>http://project.lsst.org/ts/sal_objects/help</Explanation>
    <item>
        <EFDB_Name>value</EFDB_Name>
        <Description>Attribute required by the API, but is unused.</Description>
        <IDL_Type>boolean</IDL_Type>
        <Units>unitless</Units>
        <Count>1</Count>
    </item>
</SALCommand>
<SALCommand>
    <Subsystem>CCCamera</Subsystem>
    <Version>3.7.1</Version>
    <Author></Author>
    <EFDB_Topic>CCCamera_command_initImage</EFDB_Topic>
    <Alias>initImage</Alias>
    <Device></Device>
    <Property></Property>
    <Action></Action>
    <Value></Value>
    <Explanation>http://project.lsst.org/ts/sal_objects/help</Explanation>
    <item>
        <EFDB_Name>deltaT</EFDB_Name>
        <Description>Estimate of time period before takeImages will be issued</Description>
        <IDL_Type>double</IDL_Type>
        <Units>second</Units>
        <Count>1</Count>
    </item>
</SALCommand>
<SALCommand>
    <Subsystem>CCCamera</Subsystem>
    <Version>3.7.1</Version>
    <Author></Author>
    <EFDB_Topic>CCCamera_command_endImage</EFDB_Topic>
    <Alias>endImage</Alias>
    <Device></Device>
    <Property></Property>
    <Action></Action>
    <Value></Value>
    <Explanation>http://project.lsst.org/ts/sal_objects/help</Explanation>
    <item>
        <EFDB_Name>value</EFDB_Name>
        <Description>Attribute required by the API, but is unused.</Description>
        <IDL_Type>boolean</IDL_Type>
        <Units>unitless</Units>
        <Count>1</Count>
    </item>
</SALCommand>
<SALCommand>
    <Subsystem>CCCamera</Subsystem>
    <Version>3.7.1</Version>
    <Author></Author>
    <EFDB_Topic>CCCamera_command_setFilter</EFDB_Topic>
    <Alias>setFilter</Alias>
    <Device></Device>
    <Property></Property>
    <Action></Action>
    <Value></Value>
    <Explanation>http://project.lsst.org/ts/sal_objects/help</Explanation>
    <item>
        <EFDB_Name>name</EFDB_Name>
        <Description>The filter name to install</Description>
        <IDL_Type>string</IDL_Type>
        <IDL_Size>256</IDL_Size>
        <Units>unitless</Units>
        <Count>1</Count>
    </item>
</SALCommand>
<SALCommand>
    <Subsystem>CCCamera</Subsystem>
    <Version>3.7.1</Version>
    <Author></Author>
    <EFDB_Topic>CCCamera_command_clear</EFDB_Topic>
    <Alias>clear</Alias>
    <Device></Device>
    <Property></Property>
    <Action></Action>
    <Value></Value>
    <Explanation>http://project.lsst.org/ts/sal_objects/help</Explanation>
    <item>
        <EFDB_Name>nClears</EFDB_Name>
        <Description>Number of consecutive clear operations to perform</Description>
        <IDL_Type>long</IDL_Type>
        <Units>unitless</Units>
        <Count>1</Count>
    </item>
</SALCommand>
<SALCommand>
    <Subsystem>CCCamera</Subsystem>
    <Version>3.7.1</Version>
    <Author></Author>
    <EFDB_Topic>CCCamera_command_takeImages</EFDB_Topic>
    <Alias>takeImages</Alias>
    <Device></Device>
    <Property></Property>
    <Action></Action>
    <Value></Value>
    <Explanation>http://project.lsst.org/ts/sal_objects/help</Explanation>
    <item>
        <EFDB_Name>numImages</EFDB_Name>
        <Description>Number of consecutive images to take</Description>
        <IDL_Type>long</IDL_Type>
        <Units>unitless</Units>
        <Count>1</Count>
    </item>
    <item>
        <EFDB_Name>expTime</EFDB_Name>
        <Description>Exposure time</Description>
        <IDL_Type>double</IDL_Type>
        <Units>second</Units>
        <Count>1</Count>
    </item>
    <item>
        <EFDB_Name>shutter</EFDB_Name>
        <Description>True if the shutter should be opened/closed</Description>
        <IDL_Type>boolean</IDL_Type>
        <Units>unitless</Units>
        <Count>1</Count>
    </item>
    <item>
        <EFDB_Name>sensors</EFDB_Name>
        <Description>Sensors to be read out, if blank all configured sensors will be read out</Description>
        <IDL_Type>string</IDL_Type>
        <Units>unitless</Units>
        <Count>1</Count>
    </item>
    <item>
        <EFDB_Name>keyValueMap</EFDB_Name>
        <Description>Map of additional key value pairs, e.g. imageType: XYZ, groupId: ABC</Description>
        <IDL_Type>string</IDL_Type>
        <Units>unitless</Units>
        <Count>1</Count>
    </item>
    <item>
        <EFDB_Name>obsNote</EFDB_Name>
        <Description>An arbitrary operator provided string, useful for informally flagging images</Description>
        <IDL_Type>string</IDL_Type>
        <Units>unitless</Units>
        <Count>1</Count>
    </item>    
</SALCommand>
<SALCommand>
    <Subsystem>CCCamera</Subsystem>
    <Version>3.7.1</Version>
    <Author></Author>
    <EFDB_Topic>CCCamera_command_stop</EFDB_Topic>
    <Alias>stop</Alias>
    <Device></Device>
    <Property></Property>
    <Action></Action>
    <Value></Value>
    <Explanation>http://project.lsst.org/ts/sal_objects/help</Explanation>
    <item>
        <EFDB_Name>value</EFDB_Name>
        <Description>Attribute required by the API, but is unused.</Description>
        <IDL_Type>boolean</IDL_Type>
        <Units>unitless</Units>
        <Count>1</Count>
    </item>
</SALCommand>
</SALCommandSet>
