<?xml version="1.0" encoding="UTF-8"?>
<?xml-stylesheet type="text/xsl" href="http://lsst-sal.tuc.noao.edu/schema/SALCommandSet.xsl"?>
<SALCommandSet xmlns:xsi="http://www.w3.org/2001/XMLSchema-instance" xsi:noNamespaceSchemaLocation="http://lsst-sal.tuc.noao.edu/schema/SALCommandSet.xsd">
  <SALCommand>
    <Subsystem>ATMonochromator</Subsystem>
    <Version>3.5.2</Version>
    <Author/>
    <EFDB_Topic>ATMonochromator_command_changeWavelength</EFDB_Topic>
    <Alias>changeWavelength</Alias>
    <Device/>
    <Property/>
    <Action/>
    <Value/>
    <Description>Command to change the wavelength of the monochromator</Description>
    <item>
      <EFDB_Name>wavelength</EFDB_Name>
      <Description>wavelength</Description>
      <IDL_Type>float</IDL_Type>
      <Units>meter</Units>
      <Count>1</Count>
    </item>
  </SALCommand>
  <SALCommand>
    <Subsystem>ATMonochromator</Subsystem>
    <Version>3.5.2</Version>
    <Author/>
    <EFDB_Topic>ATMonochromator_command_calibrateWavelength</EFDB_Topic>
    <Alias>calibrateWavelength</Alias>
    <Device/>
    <Property/>
    <Action/>
    <Value/>
    <Description>Command to calibrate the wavelength</Description>
    <item>
      <EFDB_Name>wavelength</EFDB_Name>
      <Description>wavelength</Description>
      <IDL_Type>float</IDL_Type>
      <Units>meter</Units>
      <Count>1</Count>
    </item>
  </SALCommand>
  <SALCommand>
    <Subsystem>ATMonochromator</Subsystem>
    <Version>3.5.2</Version>
    <Author/>
    <EFDB_Topic>ATMonochromator_command_power</EFDB_Topic>
    <Alias>power</Alias>
    <Device/>
    <Property/>
    <Action/>
    <Value/>
    <Description>Command to turn the power ON and OFF</Description>
    <item>
      <EFDB_Name>power</EFDB_Name>
      <Description>power</Description>
      <IDL_Type>boolean</IDL_Type>
      <Units>unitless</Units>
      <Count>1</Count>
    </item>
  </SALCommand>
  <SALCommand>
    <Subsystem>ATMonochromator</Subsystem>
    <Version>3.5.2</Version>
    <Author/>
    <EFDB_Topic>ATMonochromator_command_selectGrating</EFDB_Topic>
    <Alias>selectGrating</Alias>
    <Device/>
    <Property/>
    <Action/>
    <Value/>
    <Description>Select the grating (Blue,Red, Mirror) that will be in the path of light</Description>
    <item>
      <EFDB_Name>gratingType</EFDB_Name>
      <Description>grating type</Description>
      <!-- Enumeration: Grating -->
      <IDL_Type>long</IDL_Type>
      <Units>unitless</Units>
      <Count>1</Count>
      <Enumeration>gratingType_Grating_Blue,gratingType_Grating_Red,gratingType_Grating_Mirror</Enumeration>
    </item>
  </SALCommand>
  <SALCommand>
    <Subsystem>ATMonochromator</Subsystem>
    <Version>3.5.2</Version>
    <Author/>
    <EFDB_Topic>ATMonochromator_command_changeSlitWidth</EFDB_Topic>
    <Alias>changeSlitWidth</Alias>
    <Device/>
    <Property/>
    <Action/>
    <Value/>
    <Description>Command to change Front enterance or Front exit slit width to width specified</Description>
    <item>
      <EFDB_Name>slit</EFDB_Name>
      <Description>slit</Description>
      <!-- Enumeration: Slit -->
      <IDL_Type>long</IDL_Type>
      <Units>unitless</Units>
      <Count>1</Count>
      <Enumeration>slit_Slit_FrontEntrance,slit_Slit_FrontExit</Enumeration>
    </item>
    <item>
      <EFDB_Name>slitWidth</EFDB_Name>
      <Description>slitWidth</Description>
      <IDL_Type>float</IDL_Type>
      <Units>unitless</Units>
      <Count>1</Count>
    </item>
  </SALCommand>
  <SALCommand>
    <Subsystem>ATMonochromator</Subsystem>
    <Version>3.5.2</Version>
    <Author/>
    <EFDB_Topic>ATMonochromator_command_updateMonochromatorSetup</EFDB_Topic>
    <Alias>updateMonochromatorSetup</Alias>
    <Device/>
    <Property/>
    <Action/>
    <Value/>
    <Description>Command used to setup monochromator with a single command</Description>
    <item>
      <EFDB_Name>gratingType</EFDB_Name>
      <Description>Grating type</Description>
      <!-- Enumeration: Grating -->
      <IDL_Type>long</IDL_Type>
      <Units>unitless</Units>
      <Count>1</Count>
      <Enumeration>gratingType_Grating_Blue,gratingType_Grating_Red,gratingType_Grating_Mirror</Enumeration>
    </item>
    <item>
      <EFDB_Name>fontExitSlitWidth</EFDB_Name>
      <Description>slitwidth for front exit</Description>
      <IDL_Type>double</IDL_Type>
      <Units>unitless</Units>
      <Count>1</Count>
    </item>
    <item>
      <EFDB_Name>fontEntranceSlitWidth</EFDB_Name>
      <Description>slitwidth for front entrance</Description>
      <IDL_Type>double</IDL_Type>
      <Units>unitless</Units>
      <Count>1</Count>
    </item>
    <item>
      <EFDB_Name>wavelength</EFDB_Name>
      <Description>wavelength</Description>
      <IDL_Type>double</IDL_Type>
      <Units>meter</Units>
      <Count>1</Count>
    </item>
  </SALCommand>
</SALCommandSet>
