<?xml version="1.0" encoding="UTF-8"?>
<?xml-stylesheet type="text/xsl" href="http://lsst-sal.tuc.noao.edu/schema/SALCommandSet.xsl"?>
<SALCommandSet xmlns:xsi="http://www.w3.org/2001/XMLSchema-instance" xsi:noNamespaceSchemaLocation="http://lsst-sal.tuc.noao.edu/schema/SALCommandSet.xsd">
  <SALCommand>
    <Subsystem>MTVMS</Subsystem>
    <EFDB_Topic>MTVMS_command_changeSamplePeriod</EFDB_Topic>
    <Description>Change sampling period.</Description>
    <item>
      <EFDB_Name>period</EFDB_Name>
      <Description>New sample period in milliseconds.</Description>
      <IDL_Type>int</IDL_Type>
      <Units>ms</Units>
      <Count>1</Count>
    </item>
  </SALCommand>
</SALCommandSet>
