<?xml version="1.0" encoding="UTF-8"?>
<?xml-stylesheet type="text/xsl" href="http://lsst-sal.tuc.noao.edu/schema/SALCommandSet.xsl"?>
<SALCommandSet xmlns:xsi="http://www.w3.org/2001/XMLSchema-instance"
	xsi:noNamespaceSchemaLocation="http://lsst-sal.tuc.noao.edu/schema/SALCommandSet.xsd">


<SALCommand>
 <Subsystem>m1m3</Subsystem>
 <Version>2.5.3</Version>
 <Author>salgenerator</Author>
 <EFDB_Topic>m1m3_command_configure</EFDB_Topic>
 <Alias>configure</Alias>
 <Device>configure</Device>
 <Property></Property>
 <Action></Action>
 <Value></Value>
 <Explanation>http://sal.lsst.org/SAL/Commands/m1m3_command_configure.html</Explanation>
    <item>
      <EFDB_Name>spec_id</EFDB_Name>
      <Description> </Description>
       <IDL_Type>string</IDL_Type>
       <IDL_Size>1</IDL_Size>
      <Units> </Units>
      <Count>1</Count>
    </item>
</SALCommand>

<SALCommand>
 <Subsystem>m1m3</Subsystem>
 <Version>2.5.3</Version>
 <Author>salgenerator</Author>
 <EFDB_Topic>m1m3_command_status</EFDB_Topic>
 <Alias>status</Alias>
 <Device>status</Device>
 <Property></Property>
 <Action></Action>
 <Value></Value>
 <Explanation>http://sal.lsst.org/SAL/Commands/m1m3_command_status.html</Explanation>
    <item>
      <EFDB_Name>state</EFDB_Name>
      <Description> </Description>
       <IDL_Type>boolean</IDL_Type>
      <Units> </Units>
      <Count>1</Count>
    </item>
</SALCommand>

<SALCommand>
 <Subsystem>m1m3</Subsystem>
 <Version>2.5.3</Version>
 <Author>salgenerator</Author>
 <EFDB_Topic>m1m3_command_target</EFDB_Topic>
 <Alias>target</Alias>
 <Device>target</Device>
 <Property>position</Property>
 <Action></Action>
 <Value></Value>
 <Explanation>http://sal.lsst.org/SAL/Commands/m1m3_command_target.html</Explanation>
    <item>
      <EFDB_Name>azimuth</EFDB_Name>
      <Description> </Description>
       <IDL_Type>double</IDL_Type>
      <Units> </Units>
      <Count>1</Count>
    </item>
    <item>
      <EFDB_Name>elevation</EFDB_Name>
      <Description> </Description>
       <IDL_Type>double</IDL_Type>
      <Units> </Units>
      <Count>1</Count>
    </item>
</SALCommand>

<SALCommand>
 <Subsystem>m1m3</Subsystem>
 <Version>2.5.3</Version>
 <Author>salgenerator</Author>
 <EFDB_Topic>m1m3_command_update</EFDB_Topic>
 <Alias>update</Alias>
 <Device>update</Device>
 <Property>lut</Property>
 <Action></Action>
 <Value></Value>
 <Explanation>http://sal.lsst.org/SAL/Commands/m1m3_command_update.html</Explanation>
    <item>
      <EFDB_Name>lut_id</EFDB_Name>
      <Description> </Description>
       <IDL_Type>string</IDL_Type>
       <IDL_Size>1</IDL_Size>
      <Units> </Units>
      <Count>1</Count>
    </item>
</SALCommand>
</SALCommandSet>
