<?xml version="1.0" encoding="UTF-8"?>
<?xml-stylesheet type="text/xsl" href="http://lsst-sal.tuc.noao.edu/schema/SALCommandSet.xsl"?>
<SALCommandSet xmlns:xsi="http://www.w3.org/2001/XMLSchema-instance" xsi:noNamespaceSchemaLocation="http://lsst-sal.tuc.noao.edu/schema/SALCommandSet.xsd">
  <SALCommand>
    <Subsystem>LEDProjector</Subsystem>
    <EFDB_Topic>LEDProjector_command_switchAllOn</EFDB_Topic>
    <Description>Switch on all LEDs connected to the labjack.</Description>
  </SALCommand>
  <SALCommand>
    <Subsystem>LEDProjector</Subsystem>
    <EFDB_Topic>LEDProjector_command_switchAllOff</EFDB_Topic>
    <Description>Switch off all LEDs connected to the labjack.</Description>
  </SALCommand>
  <SALCommand>
    <Subsystem>LEDProjector</Subsystem>
    <EFDB_Topic>LEDProjector_command_switchOn</EFDB_Topic>
    <Description>Switch on list of LEDs, named by serial number.</Description>
    <item>
      <EFDB_Name>serialNumbers</EFDB_Name>
      <Description>Comma-separated list of LED serial numbers to be turned on.</Description>
      <IDL_Type>string</IDL_Type>
      <IDL_Size>1</IDL_Size>
      <Units>unitless</Units>
      <Count>1</Count>
    </item>
  </SALCommand>
  <SALCommand>
    <Subsystem>LEDProjector</Subsystem>
    <EFDB_Topic>LEDProjector_command_switchOff</EFDB_Topic>
    <Description>Switch off list of LEDs, named by serial number.</Description>
    <item>
      <EFDB_Name>serialNumbers</EFDB_Name>
      <Description>Comma-separated list of LED serial numbers to be turned off.</Description>
      <IDL_Type>string</IDL_Type>
      <IDL_Size>1</IDL_Size>
      <Units>unitless</Units>
      <Count>1</Count>
    </item>
  </SALCommand>
  <SALCommand>
    <Subsystem>LEDProjector</Subsystem>
    <EFDB_Topic>LEDProjector_command_adjustDACPower</EFDB_Topic>
    <Description>adjust DAC power.</Description>
    <item>
      <EFDB_Name>serialNumbers</EFDB_Name>
      <Description>Comma-separated list of LED serial numbers to be adjusted</Description>
      <IDL_Type>string</IDL_Type>
      <IDL_Size>1</IDL_Size>
      <Units>unitless</Units>
      <Count>1</Count>
    </item>
    <item>
      <EFDB_Name>dacValues</EFDB_Name>
      <Description>Comma-separated list of dac values in float or int to be adjusted</Description>
      <IDL_Type>string</IDL_Type>
      <IDL_Size>1</IDL_Size>
      <Units>unitless</Units>
      <Count>1</Count>
    </item>
  </SALCommand>
  <SALCommand>
    <Subsystem>LEDProjector</Subsystem>
    <EFDB_Topic>LEDProjector_command_adjustAllDACPower</EFDB_Topic>
    <Description>adjust All DAC channel power.</Description>
    <item>
      <EFDB_Name>dacValue</EFDB_Name>
      <Description>dac value to be adjusted</Description>
      <IDL_Type>float</IDL_Type>
      <IDL_Size>1</IDL_Size>
      <Units>Volt</Units>
      <Count>1</Count>
    </item>
  </SALCommand>
</SALCommandSet>
