<?xml version="1.0" encoding="UTF-8"?>
<?xml-stylesheet type="text/xsl" href="http://lsst-sal.tuc.noao.edu/schema/SALCommandSet.xsl"?>
<SALCommandSet xmlns:xsi="http://www.w3.org/2001/XMLSchema-instance" xsi:noNamespaceSchemaLocation="http://lsst-sal.tuc.noao.edu/schema/SALCommandSet.xsd">
    <SALCommand>
        <Subsystem>MTTCS</Subsystem>
        <Version>1.0.0</Version>
        <Author>salgenerator</Author>
        <EFDB_Topic>MTTCS_command_stopMotion</EFDB_Topic>
        <Alias>stopMotion</Alias>
        <Device/>
        <Property/>
        <Action/>
        <Value/>
        <Explanation>Stop azimuth, altitude and rotator axes and dome rotation.</Explanation>
        <item>
            <EFDB_Name>ignored</EFDB_Name>
            <Description/>
            <IDL_Type>boolean</IDL_Type>
            <Units/>
            <Count>1</Count>
        </item>
    </SALCommand>
    <SALCommand>
        <Subsystem>MTTCS</Subsystem>
        <Version>1.0.0</Version>
        <Author>salgenerator</Author>
        <EFDB_Topic>MTTCS_command_target</EFDB_Topic>
        <Alias>target</Alias>
        <Device/>
        <Property/>
        <Action/>
        <Value/>
        <Explanation>Acquire a target (slew and track).</Explanation>
        <item>
            <EFDB_Name>targetId</EFDB_Name>
            <Description/>
            <IDL_Type>long</IDL_Type>
            <Units/>
            <Count>1</Count>
        </item>
        <item>
            <EFDB_Name>coordSys</EFDB_Name>
            <Description>Coordinate system for `position`.</Description>
            <IDL_Type>long</IDL_Type>
            <Enumeration>ICRS, Observed, Mount</Enumeration>
            <Units/>
            <Count>1</Count>
        </item>
        <item>
            <EFDB_Name>position</EFDB_Name>
            <Description>Right ascension/azimuth, declination/altitude</Description>
            <IDL_Type>double</IDL_Type>
            <Units>degrees</Units>
            <Count>2</Count>
        </item>
        <item>
            <EFDB_Name>rotType</EFDB_Name>
            <Description>Coordinate system for rotAngle. One of:
    * RotSky: Position angle of focal plane +Y, measured from N through E.
      At 0 degrees, +Y is along N and +X is along E/W depending on handedness.
      At 90 degrees, +Y is along E and +X is along S/N depending on handedness.
    * RotHorizon: Position angle of focal plane +Y, measured from +Alt through +Az.
      At 0 degrees, +Y is along +Alt and +X is along +/-Az, depending on handedness.
      At 90 degrees, +Y is along +Az and +X is along -/+Alt, depending on handedness.
    * RotMount: The position sent to the instrument rotator; the details depend on the rotator.
  </Description>
            <IDL_Type>long</IDL_Type>
            <Enumeration>RotSky, RotHorizon, RotMount</Enumeration>
            <Units/>
            <Count>1</Count>
        </item>
        <item>
            <EFDB_Name>rotAngle</EFDB_Name>
            <Description/>
            <IDL_Type>double</IDL_Type>
            <Units/>
            <Count>1</Count>
        </item>
        <item>
            <EFDB_Name>numExposures</EFDB_Name>
            <Description>Number of exposures</Description>
            <IDL_Type>long</IDL_Type>
            <Units/>
            <Count>1</Count>
        </item>
        <item>
            <EFDB_Name>exposureTime</EFDB_Name>
            <Description>Exposure time per exposure</Description>
            <IDL_Type>float</IDL_Type>
            <Units>seconds</Units>
            <Count>1</Count>
        </item>
        <item>
            <EFDB_Name>domeMode</EFDB_Name>
            <Description>Mode for enclosure rotation; one of:
    * DomeTracking: track the telescope; ignore domeAzimuth.
    * DomeFixed: move to the specified domeAzimuth and stay there.</Description>
            <IDL_Type>long</IDL_Type>
            <Enumeration>DomeTracking, DomeFixed</Enumeration>
            <Units/>
            <Count>1</Count>
        </item>
        <item>
            <EFDB_Name>domeAzimuth</EFDB_Name>
            <Description>Dome azimuth; ignored if domeMode is DomeTracking</Description>
            <IDL_Type>double</IDL_Type>
            <Units/>
            <Count>1</Count>
        </item>
    </SALCommand>
    <SALCommand>
        <Subsystem>MTTCS</Subsystem>
        <Version>1.0.0</Version>
        <Author>salgenerator</Author>
        <EFDB_Topic>MTTCS_command_offset</EFDB_Topic>
        <Alias>offset</Alias>
        <Device/>
        <Property/>
        <Action/>
        <Value/>
        <Explanation>Offset the telescope. All offsets are along the arc of a great circle, whose orientation (angle from axis 0 to axis 1 at the starting point) is given by atan2(amount[1], amount[0]) and the arc length is the norm of amount.</Explanation>
        <item>
            <EFDB_Name>objectOffset</EFDB_Name>
            <Description>Amount of object offset; the axes are position[0], position[1].</Description>
            <IDL_Type>double</IDL_Type>
            <Units>degrees</Units>
            <Count>2</Count>
        </item>
        <item>
            <EFDB_Name>objectAbsolute</EFDB_Name>
            <Description>If True objectOffset is absolute, else it is relative to the current offset.</Description>
            <IDL_Type>boolean</IDL_Type>
            <Units/>
            <Count>1</Count>
        </item>
        <item>
            <EFDB_Name>boresightOffset</EFDB_Name>
            <Description>Amount of boresight offset; the axes are focal plane x, focal plane y.</Description>
            <IDL_Type>double</IDL_Type>
            <Units>degrees</Units>
            <Count>2</Count>
        </item>
        <item>
            <EFDB_Name>boresightAbsolute</EFDB_Name>
            <Description>If True boresightOffset is absolute, else it is relative to the current offset.</Description>
            <IDL_Type>boolean</IDL_Type>
            <Units/>
            <Count>1</Count>
        </item>
    </SALCommand>
</SALCommandSet>
